ITEM_ID,PRICE,CATEGORY_L1,CATEGORY_L2,PRODUCT_DESCRIPTION,GENDER
"79200e20-14e1-451f-b366-b13f8c4ed0dc",393.99,instruments,strings,"This electric guitar will delight the most demanding musician",Any
"a4fce4bd-5073-4434-ae7b-da6a4734708b",57.99,seasonal,easter,"A must-have for April",Any
"448bac96-2ade-4410-9632-e208c456fcf7",217.99,furniture,tables,"Increase your productivity with this unrivaled powder blue worktable",Any
"6fc26dd9-832e-449e-88f5-b7e3e79e4a4a",24.99,apparel,socks,"Sassy and colorful socks",F
"c0a8b935-457d-493b-aeca-f5531c02d1d6",56.99,instruments,microphone,"This microphone can be relied upon in every situation",Any
"050f28e4-376d-474b-b2d0-0b62c751e85d",453.99,electronics,computer,"This laptop computer is a boon for productivity",Any
"3f90e04e-9bfe-4fd4-a137-387b694baad2",69.99,housewares,bowls,"Chic ceramic bowl for every occasion",Any
"d725a542-ddaf-4e1c-a2fb-10628a6e1407",112.99,furniture,chairs,"Increase your productivity with this nice black office chair",Any
"68e865bc-3db7-4f5d-86e3-8e7a651cf0b7",72.99,housewares,kitchen,"Ideal for every kitchen",Any
"e6009e07-6e23-48f7-8085-426f1d466c79",210.99,furniture,tables,"Increase your productivity with this outstanding white worktable",Any
"4ea3fcbe-665b-4c33-b8b6-1d593460153d",449.99,instruments,strings,"This electric guitar will delight the most demanding musician",Any
"069e92e2-e9fe-40b9-8deb-3cf0d5ae2930",12.99,groceries,meat,"Our pork is organic and raised sustainably",Any
"05f4f79c-e6d1-4c31-bcfe-44d7e77fcb68",68.99,housewares,kitchen,"A must-have for your kitchen",Any
"82148184-2e41-471b-a0d7-e58caa2333e9",245.99,furniture,dressers,"This ideal dresser has three drawers to organize all your items",Any
"514cbd7d-71d8-4b75-8a67-448f40bab8e4",56.99,homedecor,decorative,"This metal basket will delight everyone",Any
"dad134d8-f23d-4af7-87b9-a23462f8a3a4",9.99,footwear,formal,"Pair of tan formal shoes for men",M
"cd86351f-f720-451a-94bc-07c24a8579ef",126.99,apparel,jacket,"Well-insulated jacket for men for winter",M
"ad9b2dfd-2967-4242-80b8-86f253d9d113",52.99,floral,plant,"Drought-resistant indoor plant grown sustainably on our organic farms",Any
"8b2a170c-e2e9-4d94-ae1a-994114ac11a5",67.99,accessories,belt,"Trendy belt for women",F
"cafd3a0b-1cee-4b14-a852-fe507c8197cd",149.99,apparel,shirt,"Fashionable dressy white shirt for men",M
"006fc931-62fd-4096-b7c1-809500dbd1ac",4.99,groceries,vegetables,"This flavorful veggie is a must-have in every pantry",Any
"47e444a7-9f1a-464f-b51a-9282e871ef75",4.99,groceries,dairy,"This yogurt is fresh from our dairy farms",Any
"092a278e-4d04-4ce3-bc18-e8a0491a9fb5",23.99,tools,saw,"Essential saw for every craftperson",Any
"8220a6f2-3e00-4ce9-af2d-7ce9856d5354",118.99,instruments,strings,"This electric guitar will delight the most demanding musician",Any
"b7a235ff-cf2a-4e43-ba15-7d8f0f07b178",6.99,groceries,vegetables,"This yummy veggie is a must-have in every pantry",Any
"8c80b843-7cf2-4d70-b2e9-580112732a7d",45.99,homedecor,cushion,"This light gray set cushion is very soft",Any
"168b7d52-7dbf-4f73-987b-d0fe181f778a",54.99,floral,wreath,"Fall wreath delivered fresh and vibrant from our growers",Any
"a88f0fe2-5621-4168-a378-045362dcdc91",77.99,apparel,shirt,"Trendy dressy white shirt for men",M
"c50abd81-e526-45b8-aca8-296abf01699a",9.99,footwear,sandals,"Slip-on pair of sandals for men",M
"0712d739-d058-414e-b905-703eaaa3d3ca",76.99,floral,plant,"Indoor plant delivered fresh and vibrant from our growers",Any
"dd6fdb3f-f567-45c9-ad4a-f36fcd56ad22",13.99,groceries,meat,"Our beef is raised sustainably by our farmers",Any
"fc3e1166-082b-4924-a9a9-2e1b5eb6e386",175.99,footwear,boot,"Incomparable pair of tan boots",M
"ffcc4cc8-a094-49ea-b9f2-8bf056261868",129.99,floral,plant,"Indoor plant delivered fresh and vibrant from our growers",Any
"95d8bb83-f344-47f8-b89b-c7ab3f591385",51.99,housewares,kitchen,"Unparalleled for every kitchen",Any
"be4a7449-c9a9-4528-9415-4db4116f021c",15.99,seasonal,halloween,"A must-have for that fanciful day loved by all",Any
"6111cec6-00e3-41ac-954d-59d175975492",9.99,electronics,camera,"Video camera for amateurs and professonals",Any
"f98ba1c4-fc1d-4467-83bb-014b1cdb96eb",47.99,seasonal,valentine,"Be sure to order early for that special day",Any
"76179541-8214-4940-bfa8-6d93739ba436",20.99,homedecor,decorative,"This rattan basket will delight everyone",Any
"d4cf35dd-b543-4b4f-9efb-c2de473c3fed",60.99,accessories,belt,"Swell belt for all occasions",M
"f1afa8b2-52d9-4488-84de-30875c2c9198",55.99,accessories,belt,"Trendy belt for all occasions",M
"2e02b6c4-1994-4de0-8ccb-fbf1dba1d423",148.99,homedecor,clock,"This wall clock will keep you on time",Any
"598c7f2a-b176-4900-8cf8-ec2445c1e68c",59.99,seasonal,easter,"A must-have for April",Any
"63f27bb8-d14f-471b-b317-6c3d43bd128e",63.99,floral,bouquet,"Wedding bouquet grown sustainably on our organic farms",Any
"61c2056e-e8b5-4c3b-a7b5-c2dba96075f2",337.99,instruments,percussion,"This acoustic drum is perfect for amateur and professional musicians",Any
"404414a7-9562-4f9d-ade8-06d6923cf2ae",5.99,outdoors,fishing,"Variety of fishing hooks",Any
"d4a04964-00aa-4946-bd7b-716426b4d920",198.99,apparel,jacket,"Suit for men about town",M
"f26358cc-a5ae-41f1-b6ee-2a148e236bf3",135.99,furniture,dressers,"This outstanding dresser has lots of drawers to organize all your items",Any
"079f8824-e91b-40ea-b159-5f7d0a9d9124",106.99,seasonal,christmas,"A favorite for the holidays",Any
"c09f5f3b-d1ab-4cb0-8171-d7d3365915bd",180.99,footwear,sneaker,"An all-around trendy pair of gray sneakers",F
"11b0f9f3-2c70-4c31-a6ed-a3b51799ae0b",359.99,instruments,strings,"This acoustic bass is perfect for amateur and professional musicians",Any
"ac42df7e-55a3-46b5-b64e-b7de51e4f33b",67.99,housewares,kitchen,"A must-have for your kitchen",Any
"50d59a7a-738a-4c84-9b9e-2fd119f8aacd",145.99,jewelry,necklace,"Spiffy necklace for women for any occasion",F
"58c0ca95-b1ff-4cd4-a7c2-2ea2ce714ad4",127.99,accessories,bag,"This peru-orange bag for men is incomparable for everyday use",M
"0ea1ce23-a279-407d-a68a-86c8b3e83f79",9.99,electronics,camera,"Video camera for amateurs and professonals",Any
"1168b59f-b1e3-45bf-b7bc-fd1daf349482",3.99,groceries,fruits,"Make sure to have your fresh dose of vitamin C every day",Any
"a7d17aa3-4576-4907-be47-1c2a735f90f3",148.99,jewelry,bracelet,"Sans pareil bracelet for women for every occasion",F
"ef0bcf8e-b88a-442d-9380-fc9eda149df7",19.99,outdoors,kayaking,"This paddle will improve your kayaking",Any
"2d9dfb7e-23c1-49d3-a900-cf95a9c740a2",52.99,floral,centerpiece,"Centerpiece grown sustainably on our organic farms",Any
"1956b13b-fa4f-45cf-bc3c-407339ba56a9",103.99,apparel,scarf,"Ultrachic scarf for women for every occasion",F
"a5760d6e-84c0-43e3-a262-a251ac0b8376",128.99,floral,plant,"Indoor plant grown sustainably on our organic farms",Any
"56e24d72-d09a-4ec5-8da9-d840c9f4795f",18.99,tools,set,"This set is a must-have for your toolbox",Any
"4ac6fe0c-cc84-4c7b-99e3-45c95de4e68f",67.99,housewares,kitchen,"A must-have for your kitchen",Any
"4f88d8c2-6ea8-434d-a31b-0955626c139a",306.99,instruments,strings,"This electric guitar is perfect for amateur and professional musicians",Any
"3fa257ab-5c4c-4963-941f-bc73bafc8bff",5.99,groceries,vegetables,"Keep your pantry well stocked with this delish and polyvalent veggie",Any
"94610697-2580-432a-8479-ee19686df56c",492.99,instruments,percussion,"This acoustic drum is perfect for amateur and professional musicians",Any
"961a5529-ad78-4a28-8b3e-ea491c9a1646",94.99,apparel,jacket,"Well-insulated casual jacket for women",F
"e97b9509-a1d5-4fda-b3f7-403d22accdfc",69.99,housewares,kitchen,"A must-have for your kitchen",Any
"f4d6df27-394b-42bb-b1e3-130eca6feef6",133.99,jewelry,necklace,"This swell necklace for women will be noticed by all",F
"7bc976b5-c78c-42aa-a4b2-dd734ce1047f",67.99,housewares,bowls,"This fancy wood bowl is a must-have",Any
"a70432ad-2d7b-4c00-ad48-4c90a5934aaf",104.99,apparel,shirt,"White sweatshirt for women",F
"5d56ce53-f18b-4ee0-aecd-dd96400ed49f",78.99,furniture,chairs,"Relax in this nice dark goldenrod armchair",Any
"3bde584c-b3eb-4d16-94d9-112799670674",163.99,furniture,tables,"Increase your productivity with this unparalleled pale gray worktable",Any
"5215c84a-7f87-4060-a86d-75826a35a9e4",41.99,jewelry,earrings,"Voguish earrings for women",F
"fadef46c-2b03-470d-97a3-c751f8075ec0",58.99,housewares,kitchen,"Outstanding for every kitchen",Any
"9b60b9e7-d6ec-4401-a773-7d037f858418",174.99,apparel,jacket,"Warm all seasons casual jacket for men",M
"3d8b3023-0b1e-4da4-8bc3-fc130bbedf17",144.99,accessories,glasses,"Cool glasses for women",F
"b589a708-836e-439a-b4b0-147a3f22522b",64.99,housewares,kitchen,"Ideal for every kitchen",Any
"1fe3c843-a6b6-432c-8565-456e964543ac",184.99,furniture,dressers,"This unparalleled dresser has lots of drawers to organize all your items",Any
"28c14c06-d947-44d0-96f8-dc2113845e4c",87.99,accessories,bag,"This dark slate blue bag for women is sublime for all occassions",F
"fd4829c9-5c51-49a1-ac9f-1d316506a75f",114.99,accessories,bag,"This sienna bag for men is unparalleled for everyday use",M
"ef3312a1-6dd8-4433-9c72-772dd7abae82",300.99,outdoors,kayaking,"This venturous kayak will take you everywhere",Any
"8a0dbe9a-e063-480e-8bbc-2c60f390cd13",75.99,housewares,kitchen,"A must-have for your kitchen",Any
"9c1a2048-7aac-4565-b836-d8d4f726322c",1.1,"salty snacks","potato chips","Crunchy and yummy! Crumbs in your lap!",Any
"36a73f97-5107-4471-9609-f34235123c63",116.99,outdoors,fishing,"This dependable fishing reel is sure to bring success",Any
"9c1dc656-48fb-4fd2-86b5-04da58eed610",145.99,floral,wreath,"Christmas wreath delivered fresh and vibrant from our growers",Any
"6819350e-987d-4b87-9132-6aa5ca256e9d",91.99,accessories,backpack,"Burlywood backpack is practical for traveling",Any
"71624fbc-5ef0-4ce0-badf-fca084a92595",124.99,apparel,jacket,"Cool casual denim for women for autumn",F
"84ab276d-9713-409f-861e-35502d6dc64a",14.99,books,travel,"Plan your next trip with this essential reference book on China",Any
"b5e00890-da2d-4a3e-8bce-b4ca1a0320dc",9.99,footwear,formal,"Pair of black formal heels for women",F
"6d665e0d-486e-492b-9486-ba278f387f73",44.99,homedecor,decorative,"This rattan basket is a must-have for your home decor",Any
"970e2650-8ab9-4cea-afb2-9eebdb05919d",56.99,seasonal,halloween,"Be sure to order early in October",Any
"35e2eae9-20ff-4ea0-ba75-a3b07f37a195",5.99,groceries,fruits,"Make sure to have your fresh dose of vitamin C every day",Any
"53ce7597-bb59-45e0-a3a3-ca3ef6f7ce1c",11.99,books,travel,"Plan your next trip with this essential reference book on France",Any
"b7b07f88-31b4-425b-97a9-c161199f795c",51.99,homedecor,cushion,"This tan rectangular cushion is a must-have for your house",Any
"c76284e5-0186-42af-92d2-bd572c553508",53.99,homedecor,cushion,"This pale gray rectangular cushion is a must-have for your house",Any
"99f92741-2b2f-45e0-bac4-9267db549c8b",125.99,apparel,scarf,"Flawless scarf for women",F
"0f564ecb-1567-4efd-a4f2-6370c62e64ba",97.99,seasonal,christmas,"A must-have for the holidays",Any
"6d46b8f7-8902-418c-a412-0210cdaaf19b",74.99,housewares,kitchen,"Unequaled for every kitchen",Any
"dd982af5-c41c-4c65-bbcf-f4e009f7fca9",63.99,housewares,kitchen,"Definitive for every kitchen",Any
"f8be29dd-e553-4d5b-9a8f-88c87c348061",166.99,furniture,tables,"Ideal white dining room for the whole family",Any
"f91ec34f-a08e-4408-8bb0-592bdd09375c",50.99,beauty,grooming,"Soft brush for everyday use",F
"4307367e-5c37-4798-b18b-ed1da0dd0cf4",77.99,apparel,scarf,"Spiffy scarf for women for every occasion",F
"c04b8e73-0e2e-4824-b127-621a444d88eb",63.99,seasonal,christmas,"A favorite for the holidays",Any
"0790267c-c708-424d-81f5-46903a9c8444",3.0,"food service",pizza,"Slice of delicious pepperoni pizza",Any
"94afe0c9-52c7-41f5-9478-4c150b1ca182",24.99,homedecor,lighting,"This pillar candle is a must-have for the lighting of your home",Any
"8759b4e2-51cc-456f-a224-01a34d04db2b",29.0,beauty,grooming,"Touch up on the go! Wherever, whenever!",F
"13a13747-5350-43f0-b7bf-f2fb4e6aa834",54.99,housewares,kitchen,"Unsurpassed for every kitchen",Any
"4a801886-9a83-4909-a914-5c26958bba14",61.99,housewares,kitchen,"A must-have for your kitchen",Any
"76f1dd5b-d8da-4b8e-b811-893a0f93b8de",48.99,homedecor,cushion,"This light gray square cushion is a must-have for your house",Any
"cb7d77fe-a42a-41e3-be86-c54c0aa4b432",253.99,instruments,percussion,"This drum set is perfect for amateur and professional musicians",Any
"f3407b88-742a-44b0-88da-3cc775bdb55b",146.99,electronics,headphones,"Faultless pair of headphones for listening to your music",Any
"f48751db-ecd5-4e3c-9fef-82d45c4cf51a",81.99,seasonal,christmas,"A must-have for the holidays",Any
"0429c546-72d1-4a5d-9db5-bd973c9e4461",3.99,groceries,vegetables,"Keep your pantry well stocked with this delish and polyvalent veggie",Any
"5575bf17-daa4-4a77-ba68-a859863d6a7d",187.99,footwear,sneaker,"This supercool pair of black sneakers is perfect for exploring in a new city",M
"bdf090db-87a0-4ad5-9604-59c883c6432a",128.99,apparel,jacket,"Well-insulated casual jacket for women",F
"edd7a7fa-23e2-4caa-92fa-3bdedfb68223",13.99,tools,hammer,"Essential hammer for every craftperson",Any
"844846d9-dc61-4709-8286-a0f79d6ae809",59.99,accessories,glasses,"Fashionable glasses for women",F
"ac841c3e-6a9d-42d3-8b1a-5465380c2af2",81.99,accessories,belt,"This swanky belt for women is perfect for all occasions",F
"61875c90-20ec-461b-b523-1c8a6fe6ce97",97.99,footwear,boot,"Unsurpassed pair of leather boots",M
"57a7d4c1-03f7-4a5b-a618-cbfb5a0004f1",70.99,housewares,kitchen,"Unequaled for every kitchen",Any
"323ca3fe-7849-490a-933d-e742866a2843",65.99,housewares,kitchen,"Unequaled for every kitchen",Any
"ef446e39-c864-46ea-b273-f2a48b7dc2a5",54.99,housewares,kitchen,"Definitive for every kitchen",Any
"3c378028-2226-4e87-94b4-7bc8a9aea5fe",9.99,groceries,bakery,"Cupcake made fresh daily in our kitchens",Any
"8770d681-3af6-45fa-be0a-2e97f5466ef0",61.99,housewares,kitchen,"Outstanding for every kitchen",Any
"2c59c08d-932d-4205-a692-2dbaa3d2027c",29.99,seasonal,valentine,"Be sure to order early for that special day",Any
"1f86f829-3fd7-4f4e-8003-5702c52a5034",58.99,accessories,glasses,"These groovy glasses for men are outstanding",M
"24c62ad2-6977-4f69-be75-e37d897c1434",2.1,"food service","soup and salad","Warms you to your bowels and delivers vitamins to your organs",Any
"e4f7e8b7-2c26-4939-9efd-b10f53a2ed04",321.99,instruments,keys,"This keyboard will delight the most demanding musician",Any
"9254d2a2-8e8b-4df4-af68-705a2deccda6",135.99,jewelry,bracelet,"First-rate bracelet for women for every occasion",F
"b5649d7c-4651-458d-a07f-912f253784ce",141.99,accessories,backpack,"Peru-orange backpack for women",F
"2e4d07d7-8d48-4b16-a2b0-91cbaa1f7c89",209.99,furniture,chairs,"Unequaled black chair for your office",Any
"f35ae4b4-b1ac-4c95-ac58-d66f7158680e",131.99,accessories,glasses,"Ultracool glasses for men",M
"d2d8147f-0f24-42c3-bcbe-a232bab7e94d",17.99,tools,saw,"Essential saw for every craftperson",Any
"e3b66709-fd0e-4ab6-b5e2-f3adbdf0d7e0",69.99,housewares,kitchen,"A must-have for your kitchen",Any
"0de9bba0-1149-40e9-b1a6-7dcecaf68194",2.5,"cold dispensed",fountain-non-carbonated,"Thick and fine smoothy, satisfying and healthy",Any
"bf35140f-0a5d-4462-857d-77a6a293e412",46.99,homedecor,cushion,"This light gray set cushion is a must-have for your house",Any
"1849aebd-fdda-4f05-be3f-28f2c61d8901",122.99,apparel,jacket,"Well-insulated rain jacket for men",M
"eff18c1f-12da-45fd-9600-00e2823e857b",172.99,footwear,sneaker,"Hip pair of goldenrod sneakers to explore in a new city",M
"a426a252-50ca-4a4d-b477-306985c3e0a6",34.99,outdoors,pet,"Your dog will love this accessory",Any
"cecf0bc0-822d-4119-a231-947952b718f6",54.99,seasonal,christmas,"A favorite for the holidays",Any
"311a58ac-0a23-4b31-a246-fa5f017eef71",318.99,furniture,tables,"Outstanding dark gray worktable for your office",Any
"97ea93f8-fd1c-4ee5-8081-24080139f9b1",75.99,floral,arrangement,"Roses arrangement delivered fresh and vibrant from our growers",Any
"0f441f90-99f3-49ee-bd56-599bc12536da",663.99,furniture,sofas,"Enjoy this comfy dark gray sofa",Any
"2f66acb6-61e0-409b-a0de-1f52b49536b3",13.99,groceries,seafood,"Delicious dungeness crab, always sourced sustainably",Any
"5a94b7d5-b210-44b3-9287-c8b0b5488a15",126.99,floral,plant,"Indoor plant grown sustainably on our organic farms",Any
"47404fab-577a-4691-8277-6de9ab87ea15",9.99,groceries,meat,"Our beef is organic and raised sustainably",Any
"4e2f66a8-6378-4792-800d-d781922da189",261.99,furniture,dressers,"This unparalleled dresser has one drawer to organize all your items",Any
"8e5ab54b-215a-44aa-b89f-fd5f42b95471",9.99,footwear,formal,"Pair of black wedges for women",F
"22b5146f-385d-4f6c-bc8c-8f31cf53f7c9",51.99,electronics,speaker,"These high definition speakers are unequaled for your music room",Any
"c2fc8658-462f-425c-8103-21c3a5eed2ac",70.99,housewares,bowls,"This stylish metal bowl is a must-have",Any
"123a3ba1-58b2-4e6e-84f9-52fef71e54e4",39.99,homedecor,cushion,"This light gray square cushion is a must-have for your house",Any
"372342cf-d9cc-4f0e-a3bf-3f939dd5f9b4",426.99,instruments,percussion,"This cymbal will delight the most demanding musician",Any
"c9eed2f3-8275-47a6-b485-166162262c70",9.99,beauty,bathing,"A must-have in every bathroom",Any
"0f2c95e5-baf0-4c8c-a551-c33c507ac593",47.99,homedecor,lighting,"This hanging lamp will enhance your home",Any
"b1b2b98b-5fbd-4e05-9d9f-e557409a37df",25.99,tools,wrench,"Essential wrench for every craftperson",Any
"5b53ab8d-701c-4139-bdab-dc457e546157",141.99,floral,bouquet,"Wedding bouquet delivered fresh and vibrant from our growers",Any
"60254fb3-3856-4509-ba00-b5a131789055",931.99,furniture,sofas,"Outstanding dark gray sofa for any room",Any
"8c0b69ac-e8db-4aca-83a9-1a89e0434965",112.99,jewelry,necklace,"Spiffy necklace for women for any occasion",F
"75f06592-a0a2-4dc5-acfb-76b275dae3aa",319.99,outdoors,kayaking,"Explore the waterways with this venturous kayak",Any
"fb3f96ca-1a42-4477-92bf-e3109c442b0c",106.99,instruments,wind,"This saxophone will delight the most demanding musician",Any
"f9339b98-c08c-4264-8239-804abdb54eb0",69.99,footwear,sneaker,"This pair of pale gray sneakers is awesome for exploring in the neighborhood",F
"d27f4e83-4730-4075-b5c5-766b1a732fe9",146.99,footwear,sneaker,"Vibrant pair of black sneakers for roving in a new city",M
"a4634431-29bd-45a8-801f-55fb33b68bb4",416.99,instruments,percussion,"This acoustic drum will delight the most demanding musician",Any
"47d7a314-6fe8-4e00-9586-682410719b7c",40.99,homedecor,cushion,"This red rectangular cushion is very comfy",Any
"b6295ac1-d60b-42a6-b16b-ebb433562e18",44.0,beauty,grooming,"These colours allow your inner you to shine through, but shinier.",F
"1ed3ab3f-f190-4226-8650-8fa8298b0374",37.99,seasonal,easter,"A must-have for April",Any
"ead102ca-975b-415b-86f7-2ec87a9e6f03",49.99,homedecor,cushion,"This white rectangular cushion is very nice",Any
"4c9184ea-2127-4db8-ab87-c966af888b5e",102.99,footwear,boot,"Unparalleled pair of leather boots",M
"8c273951-c115-4400-a50e-25a4bd1a9a52",50.99,floral,plant,"Drought-resistant indoor plant grown sustainably on our organic farms",Any
"772d4a37-ca54-4df2-bd5e-611ac3b9e4ac",120.99,apparel,jacket,"Well-insulated casual jacket for women for all seasons",F
"c2340902-a2ed-4ebd-a91f-b97da34283d5",59.99,seasonal,valentine,"Be sure to order early for that special day",Any
"9f7a3af3-a5d5-4a4f-9fc5-3fdae3e9787a",19.99,jewelry,earrings,"Trendy earrings for women",F
"e806c545-1004-4a21-a665-845fd321a0f7",113.99,apparel,shirt,"Hip gray dress for women",F
"b630250c-41f3-4f14-865c-c1dc12e448ac",15.99,tools,saw,"This saw is a must-have for your toolbox",Any
"208ca535-3433-429a-94a3-393c3ec3a7f1",124.99,apparel,jacket,"Well-insulated casual jacket for women",F
"854adde5-fc7b-4659-a353-c8e84668ef79",55.99,jewelry,bracelet,"A beautiful bracelet for women to adorn any wrist",F
"dbaca5e0-48e9-41d5-8c8a-4a9ff1aebdc7",9.99,footwear,sandals,"This dandyish pair of sandals for men is perfect for the summer",M
"7673321f-6042-4ad7-bc1d-4471ee1dcd1b",790.99,furniture,sofas,"This upscale sienna sofa will be the highlight of any room",Any
"a7bb3478-b9a9-43e2-bfae-39b88accf7d6",19.99,groceries,seafood,"Delicious octopus, always sourced sustainably",Any
"da045e5a-9383-482d-956b-8a3b6d705bdc",89.99,apparel,jacket,"Warm casual coat for women for winter",F
"1bb74d0b-fe39-42f0-9870-d4195a90a32c",141.99,furniture,chairs,"Unsurpassed beige chair for your office",Any
"142a8efe-18c3-4938-9978-cc8d83e8b02e",52.99,homedecor,decorative,"This glass vase will delight everyone",Any
"12e365f0-3230-4508-a96a-1ebb361aac6d",88.99,apparel,shirt,"Checkered shirt for men",M
"1513d9f0-bb81-4b0c-bab5-20e8ea67c104",58.99,beauty,grooming,"Brush your teeth after each meal with this handy toothbrush",Any
"5b7611a0-1093-470f-8aca-7f85da315624",433.99,instruments,keys,"This upright piano is perfect for amateur and professional musicians",Any
"0cfb40f1-8122-4a30-bd6e-9524b70d30b2",70.99,housewares,kitchen,"Unsurpassed for every kitchen",Any
"39bc2d5b-0d73-4d43-8cad-9fb7fcc12e13",101.99,seasonal,christmas,"A favorite for the holidays",Any
"66e5b0a9-0cc9-47b2-b78b-8730d561a297",52.99,seasonal,valentine,"Be sure to order early for that special day",Any
"26bb732f-9159-432f-91ef-bad14fedd298",58.99,housewares,kitchen,"Unparalleled for every kitchen",Any
"3e56b2bb-d367-44bc-a694-4e8823e3bec2",6.99,groceries,vegetables,"Keep your pantry well stocked with this yummy and polyvalent veggie",Any
"98863ae7-9d5a-4b56-b3e9-3c6c053114e8",9.99,footwear,formal,"Pair of sparkly formal heels for women",F
"76fa669b-1611-4f31-8377-55c3e701ced4",95.99,instruments,wind,"This saxophone is perfect for amateur and professional musicians",Any
"90074fe9-2a80-4247-86b0-12211cf024dd",100.99,accessories,glasses,"These hip glasses for men are outstanding",M
"c102c29e-ed5a-4b27-b2ec-1a4001e6757e",84.99,accessories,bag,"This black bag for men is unparalleled for everyday use",M
"836d01d4-df2c-4f79-82f3-45c077bec73f",37.99,seasonal,easter,"A must-have for April",Any
"e592c09b-990c-4b6a-842a-71c4b2de9773",102.99,apparel,scarf,"Modish scarf for women for every occasion",F
"49c8a5bf-2e7b-4072-b0cd-f8f831f84ebc",61.99,housewares,kitchen,"A must-have for your kitchen",Any
"e1105a38-cf8f-4bbf-a1de-968b94b22b80",9.99,footwear,formal,"Pair of brown formal shoes for men",M
"c7beb662-1cc4-4709-a420-ef768a43f6ad",55.99,apparel,scarf,"First-rate scarf for women",F
"5c0b070b-3bf1-4d2b-99a7-0906b90ca28f",58.99,housewares,kitchen,"Unparalleled for every kitchen",Any
"4fb90969-6e9b-41f5-8ff2-acde9878e868",43.99,homedecor,lighting,"This floor lamp will enhance your home",Any
"47134a61-d2cb-45f9-8016-7a1063250cce",9.99,footwear,formal,"Pair of brown formal shoes for men",M
"dcf8a704-e158-4d3f-85eb-f72c8200ae7c",49.99,footwear,sneaker,"An all-around supercool pair of gainsboro sneakers",F
"1ff518b5-97be-45f7-bd7e-1d70484afc72",350.99,instruments,strings,"This violin will delight the most demanding musician",Any
"124eb5d1-ebd0-46a8-b753-8995a32e0ff4",798.99,furniture,sofas,"This rich sienna sofa will be the highlight of any room",Any
"657b8b5a-9899-4670-a810-98d4293f5933",174.99,apparel,shirt,"Linen Hue casual shirt for men",M
"2de31913-a3d6-4e93-a8a9-17983f24e2f8",262.99,instruments,strings,"This electric guitar will delight the most demanding musician",Any
"9c4c0c85-7275-4393-a0ad-897148d4ba9f",95.99,seasonal,christmas,"A favorite for the holidays",Any
"48504eb2-f982-44ac-919b-0555539f525d",1216.99,electronics,camera,"This camera is perfect for capturing those special moments",Any
"c424e679-0da2-4d81-afb8-f9dc5d21ce83",133.99,apparel,jacket,"Warm casual jacket for men",M
"e41db00e-517e-4030-8d7f-347d1050ae77",69.99,housewares,kitchen,"Unrivaled for every kitchen",Any
"5138061d-7f1d-437e-ab4e-87f97f4140f8",301.99,furniture,tables,"Increase your productivity with this definitive wooden worktable",Any
"8770aa6d-44e7-4219-9ab4-71b3fd828f36",57.99,homedecor,cushion,"This gray rectangular cushion is a must-have for your house",Any
"cc3edb1a-d73a-4f6a-8718-600cba7f37b4",25.99,jewelry,earrings,"Swanky earrings for women",F
"6928c229-e860-45f9-8720-45e2ea2fae2f",126.99,accessories,watch,"This ultrahip watch for women is perfect for all occasions",F
"49f1a917-d624-4aa0-a797-35dc7f925f52",120.99,apparel,scarf,"Swell scarf for men",M
"622eb4e4-4bb9-4099-bd1b-3d64b715a92e",51.99,accessories,belt,"Edgy belt for women",F
"29cf2176-3ba3-4762-b537-66bc226a7766",200.99,instruments,wind,"This trumpet will delight the most demanding musician",Any
"78cb9e53-b00a-4c44-9007-800f70d3c7b7",119.99,floral,plant,"Indoor plant grown sustainably on our organic farms",Any
"84dc124a-699d-433a-a828-5e32044c8945",53.99,footwear,boot,"Unparalleled pair of brown boots",M
"b19613c1-f717-4fa9-bf68-a94af122dd4a",4.99,groceries,dairy,"This milk is fresh from our dairy farms",Any
"ffbf120a-0b8e-41dd-bbe9-5b2a87b0c8c5",7.99,groceries,bakery,"Bread made fresh daily in our kitchens",Any
"24867f54-16ac-4d42-9440-2ffdd06942cc",39.99,seasonal,easter,"A must-have for April",Any
"3eeaa0d2-b2bf-44d6-83cf-0bd1cb7d32f3",171.99,apparel,jacket,"Warm casual jacket for women",F
"c6a2f400-09ea-4b63-b022-b5ccc3601739",83.99,apparel,jacket,"Warm casual leather jacket for men",M
"710d86b7-71d6-4acc-973f-443f3ffbc812",66.99,floral,plant,"Drought-resistant indoor plant delivered fresh and vibrant from our growers",Any
"95aa9d7e-4b6d-4b44-a7a1-1b223dff08c1",45.99,seasonal,easter,"A favorite for early April",Any
"4adabef5-293b-42c0-b6d1-1cf853f6391d",10.99,books,travel,"Plan your next trip with this essential reference book on China",Any
"9be3c754-d792-4b9a-80e4-988130797bb1",44.99,seasonal,easter,"A favorite for early April",Any
"627ae565-6464-41a9-9562-aac81a4b62ef",94.99,furniture,chairs,"Relax in this nice dark gray armchair",Any
