ITEM_ID,PRICE,CATEGORY_L1,CATEGORY_L2,PRODUCT_DESCRIPTION,GENDER
"371cef78-adf2-4cb0-8e78-02f8cb7ee013",132.99,accessories,watch,"Edgy watch for women",F
"7a373422-fc33-4e71-959f-99998d0b7686",880.99,furniture,sofas,"Ideal dark slate gray sofa for any room",Any
"aa564ee3-67ef-4428-8ad9-fe785a0fff63",7.99,tools,screwdriver,"This screwdriver is a must-have for your toolbox",Any
"c60a61d0-d9c3-4336-88f0-aaef40a8d3e6",10.99,outdoors,camping,"This camping compass is essential in the wilderness",Any
"1da76c0c-e01d-4978-8b7b-ae031389fc3a",22.99,tools,hammer,"This hammer is a must-have for your toolbox",Any
"efb27815-d66a-4c22-915f-09566e7e091d",5.99,groceries,vegetables,"This delish veggie is a must-have in every pantry",Any
"b466c821-a8fb-492a-a789-5c7395824c38",23.99,homedecor,decorative,"This rattan basket is a must-have for your home decor",Any
"607ba878-0a8c-4330-ac83-8472886cfe2b",83.99,accessories,handbag,"Light coral handbag that works with all outfits",F
"322c0e7a-4ab8-485d-b3c4-234a5962562d",83.99,outdoors,fishing,"Outstanding fishing reel for every pole",Any
"aad9fe48-92f9-4197-af5a-505a80316c8c",66.99,jewelry,earrings,"These earrings for men are sure to show a vibrant personality",M
"c29ec39d-7e15-445f-9077-26c63abfdc04",84.99,apparel,scarf,"Funky scarf for men for every occasion",M
"e9e1a010-d806-48b3-95f1-5ef137a16e18",12.99,tools,wrench,"This wrench is a must-have for your toolbox",Any
"ff1b74e6-a4a8-495a-afe5-bb200014c20b",9.99,footwear,formal,"Pair of black formal shoes for women",F
"0bfb1cf5-f893-465c-9275-178833ad4969",54.99,outdoors,fishing,"Incomparable fishing lure for every pole",Any
"9b23f522-d90c-4f8e-9195-655ba8ca69bf",22.99,apparel,socks,"Groovy and colorful socks",F
"4a77b485-0fe7-4391-9ca2-6a29fa10574e",369.99,instruments,percussion,"This acoustic drum is perfect for amateur and professional musicians",Any
"b1eb4959-3cf7-4e0b-9473-24d0f900b0ab",109.99,outdoors,fishing,"Unequaled fishing hooks for every pole",Any
"ce8ac6db-1e73-4a0e-ae3c-0f21c6e86ae7",194.99,furniture,dressers,"Unparalleled turquoise dresser with three drawers is a must-have",Any
"16c829fc-6585-426d-a1cd-922266e20678",85.99,accessories,handbag,"Sienna handbag that works with all outfits",F
"15b3ec7d-8381-454b-ab23-4606be9a176f",81.99,accessories,handbag,"Red handbag that works with all outfits",F
"7aba3399-b868-4dad-a2fd-05c170aa4232",9.99,footwear,formal,"Pair of sparkly heels for women",F
"540fdc40-a457-46e9-8b10-14e0a2f3ed33",137.99,floral,arrangement,"Roses arrangement delivered fresh and vibrant from our growers",Any
"d213463b-d3db-47bb-8258-31bb33fbea33",55.99,housewares,kitchen,"A must-have for your kitchen",Any
"99826168-b451-4cc2-85dd-88215d8b069a",6.99,groceries,bakery,"Cupcake made fresh daily in our kitchens",Any
"c6dd0909-46f3-4cf9-a059-fbdff93198dd",56.99,accessories,belt,"Hip belt for all occasions",M
"95a38ced-a972-4e9f-b54d-fbd109ad956e",134.99,accessories,backpack,"This dark olive green backpack for men is unsurpassed for exploring everywhere",M
"7834e768-8c84-4c0b-9372-6f65a3207a14",133.99,accessories,handbag,"Light gray handbag that works with all outfits",F
"f468ce19-e359-438a-8141-8efef422a392",9.99,footwear,formal,"Pair of black formal shoes for men",M
"eba7bf2b-c55d-4375-b213-6463ac46cef3",19.99,seasonal,halloween,"Be sure to order early in October",Any
"87807a95-ee08-4a17-9a79-af93c7ccd1b5",12.99,groceries,bakery,"This flavorful strawberry cake will delight everyone",Any
"9a393431-2a27-4bb5-97fd-74ab904cec03",9.99,footwear,sandals,"Trendy pair of sandals for women",F
"be0749f9-f998-4937-aeda-1b400535bea3",173.99,apparel,jacket,"Warm casual coat for women for the mountains",F
"c3d0fa25-54b9-4876-8a83-9c10e35c711f",90.99,accessories,glasses,"These trendy glasses for men are unrivaled",M
"85ef93dc-01ed-474c-879f-984797a7d7a1",170.99,apparel,jacket,"All-seasons casual jacket for men",M
"ebee2ea6-fdc1-4d94-a9ac-b05f328e7ddb",127.99,footwear,sneaker,"An all-around bold pair of dark slate gray sneakers",M
"5ca334e8-5ae0-4935-b797-9b392dd4d0d9",9.99,footwear,formal,"Pair of hot pink formal shoes for women",F
"65b3bc05-4d84-48ef-ba0f-ce12301643c7",137.99,footwear,sneaker,"An all-around intrepid pair of black sneakers",M
"742a7479-f734-44bf-b826-f76ebe254f55",103.99,accessories,handbag,"Leather handbag that works with all outfits",F
"90946422-31ea-4dd1-8651-a9e3a122bcf6",127.99,accessories,backpack,"Dark slate gray backpack is useful for traveling",Any
"1689f5d9-8691-4738-9324-c468d62795f6",71.99,housewares,kitchen,"Outstanding for every kitchen",Any
"83095a08-2968-4275-a375-4fab404df7ac",62.99,beauty,grooming,"Razor for every bathroom",M
"da94e783-5959-4df1-bca1-6719ece02699",42.99,outdoors,pet,"Your dog will love this accessory",Any
"c01afde0-020b-4220-8006-2a40245cad8c",309.99,instruments,strings,"This electric guitar is perfect for amateur and professional musicians",Any
"2314f923-cffd-4286-aaf1-fd016bf8a06d",161.99,footwear,sneaker,"This swell pair of forest green sneakers is perfect for exploring in a new city",M
"9f251479-7904-4563-b826-cd4f3739949b",109.99,outdoors,camping,"Be sure to bring this camping tent with you to the outdoors",Any
"f151582e-ff88-4192-82b9-15bc82329e2c",237.99,apparel,shirt,"Polo tee for men for every occasion",M
"cacf945a-4c63-4797-a9a9-361e14b7001e",60.99,housewares,kitchen,"Definitive for every kitchen",Any
"898e919e-4758-41bf-bc8a-f96bcf7e375b",23.99,housewares,bowls,"This magnificent ceramic bowl is a must-have",Any
"5d6929a4-570d-4eaa-a0c4-4b1aa350add6",16.99,electronics,cable,"This high quality cabling is unrivaled for your electronics at home and on the go",Any
"9dbf7c1a-3936-42ee-8c36-a28e94a35265",528.99,furniture,sofas,"Enjoy this soft pale gray sofa",Any
"66943a0f-5410-4c68-964e-a6468237f8e9",75.99,outdoors,fishing,"Easy to use fishing net",Any
"5e794430-4bc9-411f-b912-9007baaa67e2",27.99,outdoors,pet,"Your dog will love this accessory",Any
"60555e97-aed7-4039-a3d9-324eff1f497c",250.99,outdoors,kayaking,"Explore the waterways with this bold kayak",Any
"37dc063d-f81d-4c2c-b67c-58d6c0828d0e",6.99,groceries,bakery,"Bread made fresh daily in our kitchens",Any
"de374b6b-7636-4784-b555-b5b37ee158e0",288.99,furniture,tables,"Increase your productivity with this unrivaled light gray worktable",Any
"ac46fdbc-2369-4908-b0b1-d405572e4a5c",65.99,housewares,bowls,"Classy ceramic bowl for every occasion",Any
"2b8f89d0-4078-4701-8aac-89c48d8ba392",114.99,seasonal,christmas,"A must-have for the holidays",Any
"02353f2f-f55f-4db5-b0bf-b9e588ecfe26",224.99,apparel,shirt,"Dapper dressy white shirt for men",M
"04f098b3-f42f-4f8a-96b4-63cb789d00c0",175.99,outdoors,camping,"This camping tent is a must-have for your next trip",Any
"72179022-fcea-42f0-bc31-f0482d7a2e66",171.99,furniture,tables,"Relax and sip your coffee with this definitive gainsboro table",Any
"b2acb802-2873-4604-87ae-4f01f1dafb80",84.99,apparel,jacket,"Well-insulated casual coat for men for the mountains",M
"8d67146f-0b59-4761-9120-34ebfee7b299",11.99,groceries,meat,"Our beef is raised sustainably by our farmers",Any
"44193a01-20c1-4a97-896f-97940ec25ea6",189.99,apparel,shirt,"Black casual shirt for men",M
"82d6418c-0c2c-4be8-805d-a02a68b712e5",470.99,outdoors,kayaking,"This intrepid kayak will take you everywhere",Any
"564f9ced-8823-45ed-a781-1dc555353dd9",123.99,accessories,watch,"Ultrachic watch for women",F
"8a94535e-4638-43ed-ab9a-2ac90849a98b",63.99,electronics,speaker,"These faultless speakers are unsurpassed for your music room",Any
"f47de389-968c-4387-b753-5fede3cbb100",200.99,apparel,jacket,"Warm all seasons casual jacket for men",M
"462d6acb-8cb9-4d11-aeef-7942d51345d8",87.99,instruments,microphone,"This authoritative microphone can be relied upon in every situation",Any
"db4f21bd-9abf-4213-81ab-30360979884d",92.99,seasonal,christmas,"A favorite for the holidays",Any
"c11354c7-a2fa-489d-9850-1ce5dcebeec5",143.99,accessories,glasses,"Cool glasses for men",M
"40b1b91a-d1ff-40cf-8ea6-cea00103c8c7",9.99,electronics,camera,"Camera for amateurs and professonals",Any
"ba78ccfe-ac38-41e8-8129-1364f0395d37",345.99,instruments,strings,"This electric guitar will delight the most demanding musician",Any
"46edff4c-918c-465a-8e03-2c30cff1a387",160.99,apparel,shirt,"Red casual shirt for men",M
"94cc3c8d-7efd-4f7b-84d0-9996f7e90c2f",66.99,housewares,kitchen,"Unequaled for every kitchen",Any
"8a5382dc-9350-46d1-a21f-bfdff7b2a03f",150.99,instruments,microphone,"This authoritative microphone can be relied upon in every situation",Any
"39ebddd2-7869-48a0-a3c4-5d9ce73bc04b",18.99,apparel,socks,"These socks are very snug for the office",F
"7d676725-83fd-47a4-bd64-8acbed6a5e74",196.99,apparel,jacket,"Well-insulated casual coat for men for the mountains",M
"91d0333b-76ec-4271-901a-6bb79cd9f12b",45.99,homedecor,lighting,"This floor lamp will enhance your home",Any
"425cc876-3935-4e87-ad8d-77f42b0b6a75",67.99,housewares,kitchen,"A must-have for your kitchen",Any
"c8312844-248a-4a07-96a1-4c02cb1e2471",169.99,furniture,tables,"This definitive tan dining table will delight everyone",Any
"4e59a438-e915-44d8-b15e-75b923c60639",186.99,outdoors,camping,"Be sure to bring this camping tent with you to the outdoors",Any
"c2d24d02-baf0-49ae-bcf7-e696bec74e58",108.99,footwear,sneaker,"Fashionable pair of black sneakers to explore in the city",M
"9b777b98-9199-4efd-a46f-75429f6779e8",11.99,groceries,bakery,"Bagel made fresh daily in our kitchens",Any
"73b369ae-6772-4375-b0d3-abcf26d55d26",9.99,footwear,formal,"Pair of brown formal shoes for men",M
"fe77abc8-fd8b-4bf2-aac0-8375f77e4b2f",83.99,jewelry,bracelet,"A exquisite bracelet for women to adorn any wrist",F
"c3475696-e060-4672-990d-99594ed8217a",56.99,seasonal,christmas,"A favorite for the holidays",Any
"4645c8af-8437-4380-b4e4-ef6f8b0f67b4",53.99,homedecor,lighting,"This table lamp will enhance your home",Any
"1bfbe5c7-6f02-4465-82f1-6083a4b302c0",67.99,beauty,grooming,"Razor for every bathroom",M
"0d76bb55-cd0f-4efb-afda-613b6c6e1fae",113.99,accessories,glasses,"These ultrahip glasses for women are perfect everywhere",F
"003e4953-d6cb-400c-90f6-9b0216b4603e",76.99,floral,plant,"Drought-resistant indoor plant grown sustainably on our organic farms",Any
"4d247a1f-2296-49c7-b0a5-6a0fc8749af9",176.99,apparel,shirt,"White coat for women",F
"07441beb-9b1a-4c25-b302-2f11362cff86",42.99,accessories,belt,"Supercool belt for women",F
"4941c536-ec23-481f-ae99-ec432d1ef35b",98.99,outdoors,fishing,"Reliable fishing Lure for every angler",Any
"d58cc491-e8ad-4f31-b6d5-4bcf417b40bd",143.99,jewelry,necklace,"Ultracool necklace for everyday wear",M
"678107a8-6a30-43c8-87b3-4f32764fb94d",36.99,seasonal,easter,"A favorite for early April",Any
"b41f8f1f-3874-4fa9-8a6e-d9b65a2902df",94.99,jewelry,bracelet,"A swell bracelet for men",M
"317d03c3-1aba-4839-ab93-64c1db962444",29.99,homedecor,cushion,"This light gray set cushion is very comfy",Any
"02f7e73f-b6fe-4ffd-bd06-60c6cb35d60f",17.99,homedecor,lighting,"This taper candle will enhance your home",Any
"af669fc5-d861-41dd-b6a0-30fc30519252",13.99,outdoors,pet,"Your pet will love this accessory",Any
"180575fc-ef84-48fc-a83f-067d50141221",162.99,furniture,chairs,"Increase your productivity with this nice dark gray office chair",Any
"26b2bda2-9397-4d0c-b5bb-9190dbba3acb",377.99,electronics,television,"This television is perfect for every room",Any
"d72a08ef-3e61-4648-ade8-b5d889e2d790",136.99,instruments,keys,"This keyboard will delight the most demanding musician",Any
"181136fc-b294-4594-afc6-3eb9c8185de6",14.99,apparel,socks,"Your game will improve with these performance socks",F
"3d23fa73-8487-4261-ae29-1730ccd6210c",64.99,housewares,kitchen,"A must-have for your kitchen",Any
"f10a57a1-bd56-4118-a083-4838b0aeccfc",106.99,apparel,jacket,"Warm casual jacket for men",M
"5cf1825f-b9e9-4168-a4a7-ac516733417c",9.99,footwear,formal,"Pair of brown formal shoes for women",F
"8bac2e13-8ff6-4e03-b0ae-961a07020835",209.99,electronics,speaker,"Authoritative speakers to fill the house with beautiful music",Any
"62259467-5d98-4c6d-a4f2-72e57bf52da6",58.99,seasonal,valentine,"A must-have for that special day",Any
"a4c0f41d-4e7d-422c-86f1-57432c0fdba2",69.99,housewares,kitchen,"A must-have for your kitchen",Any
"4b69ea5b-2114-45b3-8194-98aa5e44d9c9",15.99,groceries,bakery,"This delicious lemon cake will delight everyone",Any
"ea18e120-48e8-4874-b462-bd934d1b77ff",52.99,housewares,bowls,"Appealing wood bowl for every occasion",Any
"2ab5209d-519d-41ed-a57d-4e67569cad0e",40.99,homedecor,lighting,"This jar candle will enhance your home",Any
"9f5d5280-76ef-43fa-af68-f0ba26a5f640",21.99,tools,axe,"Essential axe for every craftperson",Any
"5395050a-b064-421f-9023-a269749bda4b",290.99,furniture,dressers,"This outstanding dresser has lots of drawers to organize all your items",Any
"f99e3fe4-6d50-470b-9925-6801020b262a",42.99,beauty,grooming,"Razor for every bathroom",Any
"cd1a0228-7d3d-4782-a1fb-c1e99bc939b3",54.99,seasonal,christmas,"A favorite for the holidays",Any
"a7aeba8c-1feb-4f9c-94d8-031612c55fb8",15.99,books,travel,"Plan your next trip with this essential reference book on Russia",Any
"a4173910-cab1-4897-8317-ac138109ba8d",222.99,apparel,shirt,"Blue green shirt for men",M
"fd282367-138f-4f8c-bd7b-4e07242bff34",193.99,apparel,jacket,"Cool all seasons casual jacket for men",M
"f7d6519f-eba5-4b05-945c-a861d580c99b",131.99,floral,arrangement,"Roses arrangement grown sustainably on our organic farms",Any
"39300780-00db-40bd-97e4-0a8c35f003bf",702.99,furniture,sofas,"Enjoy this soft gray sofa",Any
"59719e89-9677-4201-8aad-fb0157bbd30c",205.99,furniture,chairs,"Relax in this comfy light gray armchair",Any
"f6cd5dd2-d3ea-4858-844a-04879153e459",95.99,accessories,backpack,"This black backpack for women is first-class for the season",F
"afba8eed-c114-422f-8960-13f90d2657ff",80.99,footwear,boot,"Unrivaled pair of black boots",M
"ce390822-2cb8-4ec8-b3d0-128d68762dc4",4.99,groceries,fruits,"This delicious fruit is everyone's favorite",Any
"f57c96de-c35d-4b98-af5a-566f9479630d",78.99,jewelry,bracelet,"Sublime bracelet for women for every occasion",F
"94710642-7b99-4d19-b637-6c445b3e3e1d",91.99,floral,plant,"Indoor plant grown sustainably on our organic farms",Any
"e7950511-8f63-4c48-9c9a-6d9f3002306d",43.99,homedecor,decorative,"This ceramic vase is a must-have for your home decor",Any
"d0062fa5-02b3-4c94-be9f-2fdafa7cde2d",145.99,accessories,backpack,"This gainsboro backpack is definitive for the season",Any
"aca9059a-3245-49e2-9578-c5c21e1d1a85",9.99,footwear,formal,"Pair of blue heels for women",F
"1827f353-5bb3-4061-8d70-fe8d813113f0",61.99,apparel,scarf,"Ultrachic scarf for women for every occasion",F
"6c9e5a95-da20-41d7-acbe-5a66d02a3488",124.99,footwear,boot,"This pair of brown boots is unrivaled for the season",M
"f7b35f32-047d-4d05-be52-d38f648fe62d",118.99,jewelry,bracelet,"This refined bracelet for women will turn heads",F
"543d28a2-c1f0-42bd-87c1-de4d9b546b9e",57.99,seasonal,easter,"A favorite for early April",Any
"c6f84710-d744-462e-970a-9fdf9352f64b",136.99,accessories,backpack,"This dark olive green backpack is outstanding for the season",Any
"d75b932b-0593-4cbe-b61d-a9b2dbd16e51",120.99,apparel,scarf,"Fashionable scarf for men for every occasion",M
"8892e3b5-ac5e-4e02-9e67-6b273c4ac114",280.99,furniture,tables,"Increase your productivity with this unsurpassed white worktable",Any
"6377bbe2-0972-4376-a797-1af84af9a3a6",325.99,furniture,tables,"Definitive wooden worktable for your office",Any
"3cd33786-a655-407f-b22f-c4150b1e529e",85.99,accessories,backpack,"Teal backpack is convenient for traveling",Any
"11787eea-3b60-4ac6-89d5-8bce503b2ad0",64.99,housewares,bowls,"This lovely ceramic bowl is a must-have",Any
"d68ad334-88ed-4ee6-a373-704927495e8b",11.99,apparel,socks,"These groovy colorful socks will brighten smiles",M
"c24f3888-fdf7-44d6-bf3e-26ae57cba8b9",55.99,housewares,kitchen,"A must-have for your kitchen",Any
"d2d5b3ba-8e15-4161-b50a-e56869e20eb2",84.99,accessories,backpack,"Black men's backpack for gallivanting everywhere during the season",M
"06acd586-2c90-486f-9a26-75ce1205e25f",187.99,footwear,sneaker,"This pair of pink sneakers is awesome for exploring outdoors",F
"59a9a899-f122-4e4e-8796-fe683d90fcc3",7.99,groceries,meat,"Our pork is organic and raised sustainably",Any
"6fd585f4-1edf-4235-83ab-51f871f95f36",134.99,floral,wreath,"Christmas wreath grown sustainably on our organic farms",Any
"e588910b-a9fb-4717-a2c0-5c476505b5d2",93.99,floral,wreath,"Wedding wreath delivered fresh and vibrant from our growers",Any
"5eddfb54-b2cf-4616-a5d0-08c509074a23",85.99,accessories,handbag,"This trendy burlywood handbag is the perfect accessory for casually wandering all over",F
"5106afab-048f-4d9f-b62b-3166e42ba01e",5.99,outdoors,camping,"This camping bottle is a must-have for your next trip",Any
"544c63ea-7c23-41f5-9841-9960ade21c54",37.99,beauty,grooming,"Soft toothbrush for everyday use",Any
"e6c07e26-3f21-4b47-9f78-0afd24dfa409",68.99,seasonal,christmas,"A favorite for the holidays",Any
"277b9636-f9d4-46f7-9910-6a794f478740",20.99,tools,wrench,"This wrench is a must-have for your toolbox",Any
"7fd05ca4-ac20-46cf-b4f8-87147eef8d65",71.99,beauty,bathing,"Organic soap for everyday use",Any
"2c20c3cd-3aa7-4882-a621-32c38fb20294",9.99,footwear,formal,"Pair of brown formal shoes for men",M
"6e329907-dc47-4dc8-982c-6ff32616551f",116.99,floral,arrangement,"Mixed arrangement grown sustainably on our organic farms",Any
"e34b3936-d740-4952-b572-ef984e3919ca",120.99,seasonal,christmas,"A favorite for the holidays",Any
"b884792f-6c44-478e-ae0b-eae89f284f3b",114.99,electronics,headphones,"This faultless pair of headphones is ideal in clarity",Any
"89c4eeb4-c146-4434-a9f1-6943b4b552dc",116.99,floral,arrangement,"Roses arrangement grown sustainably on our organic farms",Any
"0c4e5ca2-93cd-4ddb-a5d3-197fa2221ead",52.99,outdoors,pet,"Your pet will love this accessory",Any
"1ea485c1-07b2-4278-be45-25cbf618b3e9",102.99,apparel,jacket,"Well-insulated casual jacket for women for all seasons",F
"d08a900a-211d-4020-8d8b-b36659ecae7c",54.99,seasonal,valentine,"A must-have for that special day",Any
"41fcefca-7208-4a6d-8c75-7b8139c769df",17.99,tools,plier,"Essential plier for every craftperson",Any
"d78a318a-ca96-4bb3-9f9f-90847b105f2a",9.99,beauty,bathing,"A must-have in every bathroom",Any
"2adca223-bbf0-46d4-9f4a-72666293b174",9.99,footwear,formal,"Pair of black heels for women",F
"b31c5f96-8a7d-40c7-8f0a-f587c1af4476",21.99,homedecor,lighting,"This table lamp is a must-have for the lighting of your home",Any
"4e44c0c1-40d0-43dd-a7fb-8454d779296d",104.99,accessories,handbag,"An all-around convenient handbag for any occasion",Any
"6ae76ab4-ad9a-4db0-9a24-7ae532647a41",40.99,outdoors,fishing,"Definitive fishing reel for every pole",Any
"0395c84b-d532-495d-8b4c-25cbaff606f7",107.99,outdoors,camping,"This camping tent is a must-have for your next trip",Any
"5c111431-fbc2-4a49-9c38-83dd5c37586a",15.99,seasonal,easter,"A must-have for April",Any
"183e6812-3a36-4709-8815-71639f63f73f",25.99,seasonal,valentine,"A must-have for that special day",Any
"49f48b44-2a8e-4922-b2ff-2ff8c52b43f3",56.99,floral,wreath,"Wedding wreath grown sustainably on our organic farms",Any
"75edcc32-739d-4f67-aa1b-167ccb734c48",131.99,accessories,glasses,"These fashionable glasses for women are perfect everywhere",F
"60519db3-763d-41c8-aaf2-630799feefd5",46.99,seasonal,easter,"A favorite for early April",Any
"72fc1056-4862-463b-ae42-f703ff421879",63.99,housewares,kitchen,"A must-have for your kitchen",Any
"3e1e85cc-1df4-40c6-9b4f-b92807f25477",9.99,footwear,formal,"Pair of rosy-brown formal shoes for men",M
"b5daf920-8f69-4603-9ccb-1d7f2b77656e",65.99,beauty,grooming,"Razor for every bathroom",Any
"9b5c3853-6fd8-485b-8448-2a4fdabcbb69",21.99,seasonal,halloween,"A must-have for that fanciful day loved by all",Any
"4d50853d-a606-4a90-914b-e04c1b405725",202.99,instruments,keys,"This keyboard will delight the most demanding musician",Any
"1deee92a-3441-4b96-a91a-5ae5f705963e",215.99,instruments,percussion,"This acoustic drum will delight the most demanding musician",Any
"b101a661-1448-4331-b2a3-42ea72442d13",147.99,homedecor,clock,"This alarm clock will keep you on time",Any
"e14a7ad9-9054-4abd-90f6-9b78fd10f5e3",296.99,instruments,percussion,"This acoustic drum is perfect for amateur and professional musicians",Any
"336ab80b-95c7-4290-97cb-f4d7744cc26e",52.99,footwear,sneaker,"An all-around fashionable pair of light gray sneakers",F
"d3aac0e7-9b01-494a-82e3-5da750664f38",80.99,seasonal,christmas,"A must-have for the holidays",Any
"aee3290c-fe89-4606-916f-b59867dbcf04",27.99,books,cooking,"Learn to cook Morrocan cuisine with these easy recipes",Any
"6b229d13-22a7-44d3-a13c-fd98dda49217",99.0,beauty,grooming,"A great selection of makeup brushes; look good just carrying it around!",F
"8cd7ffe0-a8a6-45b1-8d1f-bf731c9cd17b",5.99,apparel,socks,"Your game will improve with these breathable socks",M
"a0fed439-c8dd-46c0-8879-794d8fe8b632",167.99,furniture,dressers,"Unsurpassed dark gray dresser with lots of drawers is a must-have",Any
"ae9a56ef-5dca-4ee9-b671-aaac2521613e",14.99,tools,knife,"This knife is a must-have for your toolbox",Any
"d24d73d1-2c7e-4fe8-abe7-88de2c2bca51",101.99,accessories,glasses,"These cool glasses for women are perfect everywhere",F
"31efcfea-47d6-43f3-97f7-2704a5397e22",209.99,footwear,sneaker,"Ultrahip pair of gainsboro sneakers for walking in a new city",F
"80795911-b1da-44cc-91c6-d6e320068cbb",4.99,groceries,dairy,"This milk is fresh from our dairy farms",Any
"bfbd28d2-d351-4a21-b799-9ba6a74c7b96",42.99,housewares,bowls,"This elegant ceramic bowl is a must-have",Any
"2494d3bb-abf7-4a6f-b9fd-56eff8edc1da",75.99,housewares,kitchen,"Ideal for every kitchen",Any
"49ac9399-751f-451d-a21c-5d8b6f29354f",90.99,accessories,belt,"Dapper belt for all occasions",M
"b44343a2-6f82-41b1-b052-52e63b6ad844",147.99,floral,plant,"Drought-resistant indoor plant delivered fresh and vibrant from our growers",Any
"e5e842c6-9d8e-4940-a245-a0f02a5552ad",9.99,footwear,formal,"Pair of black heels for women",F
"b455a03d-a326-4d34-b45b-c2d44ae46dc6",76.99,furniture,chairs,"Enjoy this soft dark gray dining chair",Any
"e159b541-4718-437b-92fe-d6f4892dffd8",15.99,apparel,socks,"Modish and colorful socks",F
"d062cb1b-09de-4b7f-bfd3-b0136c87266b",119.99,accessories,backpack,"This dark khaki backpack for men is unsurpassed for exploring far and wide",M
"96596821-ee6c-43ef-849d-44a305d745ae",132.99,apparel,jacket,"This dark olive green jacket for women is perfect for the city",F
"28762499-dd36-4b23-96d3-db3eeeaed548",399.0,furniture,sofas,"Comfy, warm, and nice.",Any
"471622d6-3300-4591-816b-ab8487e70274",55.99,housewares,kitchen,"A must-have for your kitchen",Any
"a9d41cae-8d0b-40e9-b198-d18dc0b81158",115.99,seasonal,christmas,"A must-have for the holidays",Any
"2a68a810-b819-4d5c-9c13-c43be2eba3c4",15.99,homedecor,decorative,"This rattan basket is a must-have for your home decor",Any
"952413d6-ecea-4a6e-87e7-f33103ce8b29",21.99,seasonal,easter,"A favorite for early April",Any
"a4e927f7-53bb-4f85-9284-26d150330d59",9.99,footwear,sandals,"This ultrachic pair of sandals for woman is perfect for the summer",F
"122f738a-92c6-479c-9bd7-c45b17bf0417",122.99,apparel,scarf,"Groovy scarf for men",M
"0d354dd4-ebd3-4787-8c9f-dd75f6f401a4",35.99,seasonal,valentine,"Be sure to order early for that special day",Any
"3525bbf7-dc07-4b4f-b0e7-5874f564655c",153.99,instruments,percussion,"This acoustic drum is perfect for amateur and professional musicians",Any
"e841f219-7a7c-4509-bfe2-c13239950051",172.99,apparel,jacket,"Cool casual jacket for women for all seasons",F
"1d584a1e-5523-4af1-b9ef-9708bed8da39",57.99,housewares,kitchen,"A must-have for your kitchen",Any
"f8e5aca7-17a9-49ca-afb1-19d637e90cd8",75.99,housewares,kitchen,"A must-have for your kitchen",Any
"23f376ce-62ac-40e0-ac3a-3db18b902780",22.99,groceries,seafood,"Delish oysters, always sourced sustainably",Any
"dff3f75f-838d-4b4d-9c7c-cee7ae2aac10",9.99,footwear,formal,"Pair of brown formal shoes for men",M
"dd8299a1-8752-458d-9f24-3cd26147e7c8",773.99,furniture,sofas,"This upscale dark slate gray sofa will be the highlight of any room",Any
"b947ee58-a7e7-40bf-9926-42a445f3480f",57.99,housewares,kitchen,"A must-have for your kitchen",Any
"9b7c2e0c-ad9d-4269-a904-f5a948b46f66",126.99,accessories,glasses,"Swell glasses for men",M
"766b6412-c63e-44de-b1ec-a457ca39d48d",108.99,floral,bouquet,"Wedding bouquet grown sustainably on our organic farms",Any
"fb25a396-0a15-4a43-816c-ba79cad09621",9.99,footwear,formal,"Pair of sparkly heels for women",F
"98d69241-7b11-46cf-94c9-8adc28ef1956",10.99,apparel,socks,"Performance socks for all sport activities",M
"4cf78f85-4200-469c-b7b9-05c93770bf44",146.99,seasonal,christmas,"A favorite for the holidays",Any
"e30ac0a3-8fbc-446a-a97c-4efff7c00c54",100.99,floral,wreath,"Christmas wreath grown sustainably on our organic farms",Any
"a15e69d5-0765-4be4-8932-cf006edeff0c",13.99,groceries,meat,"Our beef is organic and raised sustainably",Any
"0e2fdf0e-a5cd-424e-b58f-aa5ab24ab903",54.99,seasonal,easter,"A favorite for early April",Any
"7b5edb22-174f-434b-8255-2056ddeb095a",57.99,seasonal,halloween,"Be sure to order early in October",Any
"e0902ea2-9c81-4049-b933-aedf709911a1",58.99,floral,arrangement,"Lilies arrangement delivered fresh and vibrant from our growers",Any
"8a740ed4-b238-4131-b654-1e031c1ae7c6",270.99,footwear,boot,"Unrivaled pair of brown boots",M
"838c1bd8-b433-4eba-aec6-34255db327dc",1692.99,electronics,camera,"This camera is perfect for capturing those special moments",Any
"6bd33faa-9715-4f07-8858-bd509954b0b1",65.99,seasonal,christmas,"A favorite for the holidays",Any
"e06f53cd-7776-41ce-9f7a-a88986192e24",158.99,furniture,chairs,"Modish goldenrod armchair for any room",Any
"5561690b-254e-4c4c-8ae1-4642e400e18d",12.99,groceries,meat,"Our beef is raised sustainably by our farmers",Any
"7859ff06-a36e-4f37-b3af-ab1e0d0a6a73",145.99,seasonal,christmas,"A must-have for the holidays",Any
